{
  "$schema": "../../../schemas/source-spell-observation.schema.json",
  "schema_version": "0.1.0",
  "observation_id": "aon:spell.unsettling-presence:d1bdb2e76976dcb5",
  "entity_type": "spell",
  "source": {
    "site_id": "aon",
    "url": "https://www.aonprd.com/SpellDisplay.aspx?ItemName=Unsettling+Presence",
    "license_url": "https://www.aonprd.com/Licenses.aspx",
    "declared_publisher": "Paizo",
    "first_party_status": "confirmed"
  },
  "retrieval": {
    "retrieved_at": "2026-08-19T23:26:26.883Z",
    "http_status": 200,
    "content_sha256": "d1bdb2e741e2f443dd1cf277ff9b09c08928d4d5eb8817ecad6dba7bd0e7b8a8",
    "raw_artifact_path": "../../raw/level-1/unsettling-presence/aon.html",
    "response_content_type": "text/html; charset=utf-8"
  },
  "parser": {
    "name": "aon-bounded-spell-adapter",
    "version": "0.1.5",
    "parsed_at": "2026-08-19T23:26:26.887Z"
  },
  "page": {
    "title_raw": "Unsettling Presence",
    "breadcrumbs_raw": [
      "Spells",
      "Unsettling Presence"
    ],
    "license_notice_raw": null,
    "source_notice_raw": "Haunted Heroes Handbook pg. 29"
  },
  "spell_raw": {
    "name_raw": "Unsettling Presence",
    "alternate_names_raw": [],
    "school_raw": "necromancy (haunted) [emotion, fear, mind-affecting]",
    "subschool_raw": "haunted",
    "descriptors_raw": [
      "emotion",
      "fear",
      "mind-affecting"
    ],
    "levels_raw": "arcanist 2, bard 2, medium 1, mesmerist 2, occultist 2, psychic 2, shaman 2, sorcerer 2, witch 2, wizard 2",
    "domains_raw": null,
    "casting_time_raw": "1 standard action",
    "components_raw": "V, S",
    "range_raw": "close (25 ft. + 5 ft./2 levels)",
    "delivery_fields_raw": [
      {
        "label_raw": "Area",
        "value_raw": "one 5-ft. cube/level (S)",
        "kinds": [
          "area"
        ]
      }
    ],
    "duration_raw": "1 hour/level (D)",
    "saving_throw_raw": "Will negates",
    "spell_resistance_raw": "yes",
    "description_raw": "Those in this spell’s area who fail their Will saving throws harbor a faint sense of paranoia and evoke the same feeling in others for the duration of the spell. Domesticated animals (not including familiars and animal companions) don’t willingly approach affected creatures unless the animal’s master succeeds at a DC 25 Handle Animal, Ride, or wild empathy check. Affected creatures take a –4 penalty on Handle Animal, Ride, and wild empathy checks against familiars, animal companions, animal cohorts, and other permanent companions provided by class abilities for the spell’s duration. Anyone an affected creature interacts with must succeed at a Will save or have its initial attitude automatically worsened by one step for the spell’s duration. Every time an affected creature attempts a Sense Motive check to get a hunch or detect a Bluff from another creature (or vice versa), it must succeed at a Will save or automatically assume the other party is lying or otherwise harbors ill will against it. Each time this spell causes an affected creature (or someone interacting with the affected creature) to attempt a Will saving throw, the spell’s hauntlike manifestation occurs.",
    "links_raw": [
      {
        "anchor_text_raw": "Haunted Heroes Handbook pg. 29",
        "href_raw": "http://paizo.com/products/btpy9nft?Pathfinder-Player-Companion-Haunted-Heroes-Handbook",
        "href_resolved": "http://paizo.com/products/btpy9nft?Pathfinder-Player-Companion-Haunted-Heroes-Handbook",
        "source_field": "spell_raw.source_book_raw",
        "context_raw": "spell_raw.source_book_raw",
        "role_hint": "publication",
        "target_entity_type_hint": "publication",
        "target_entity_id_hint": "publication.haunted-heroes-handbook"
      },
      {
        "anchor_text_raw": "necromancy",
        "href_raw": "SpellDefinitions.aspx?ID=7",
        "href_resolved": "https://www.aonprd.com/SpellDefinitions.aspx?ID=7",
        "source_field": "spell_raw.school_raw",
        "context_raw": "spell_raw.school_raw",
        "role_hint": "classification",
        "target_entity_type_hint": "magic_school",
        "target_entity_id_hint": "magic-school.necromancy"
      },
      {
        "anchor_text_raw": "haunted",
        "href_raw": "SpellDefinitions.aspx?ID=53",
        "href_resolved": "https://www.aonprd.com/SpellDefinitions.aspx?ID=53",
        "source_field": "spell_raw.school_raw",
        "context_raw": "spell_raw.school_raw",
        "role_hint": "classification",
        "target_entity_type_hint": "subschool",
        "target_entity_id_hint": "subschool.haunted"
      },
      {
        "anchor_text_raw": "emotion",
        "href_raw": "SpellDefinitions.aspx?ID=36",
        "href_resolved": "https://www.aonprd.com/SpellDefinitions.aspx?ID=36",
        "source_field": "spell_raw.school_raw",
        "context_raw": "spell_raw.school_raw",
        "role_hint": "classification",
        "target_entity_type_hint": "descriptor",
        "target_entity_id_hint": "descriptor.emotion"
      },
      {
        "anchor_text_raw": "fear",
        "href_raw": "SpellDefinitions.aspx?ID=38",
        "href_resolved": "https://www.aonprd.com/SpellDefinitions.aspx?ID=38",
        "source_field": "spell_raw.school_raw",
        "context_raw": "spell_raw.school_raw",
        "role_hint": "classification",
        "target_entity_type_hint": "descriptor",
        "target_entity_id_hint": "descriptor.fear"
      },
      {
        "anchor_text_raw": "mind-affecting",
        "href_raw": "SpellDefinitions.aspx?ID=46",
        "href_resolved": "https://www.aonprd.com/SpellDefinitions.aspx?ID=46",
        "source_field": "spell_raw.school_raw",
        "context_raw": "spell_raw.school_raw",
        "role_hint": "classification",
        "target_entity_type_hint": "descriptor",
        "target_entity_id_hint": "descriptor.mind-affecting"
      }
    ],
    "references_raw": [],
    "mythic_text_raw": null,
    "source_book_raw": "Haunted Heroes Handbook",
    "source_page_raw": "29",
    "supplemental_sources_raw": [],
    "pfs_status_raw": "legal",
    "sections_raw": [
      {
        "heading_raw": null,
        "body_raw": "Those in this spell’s area who fail their Will saving throws harbor a faint sense of paranoia and evoke the same feeling in others for the duration of the spell. Domesticated animals (not including familiars and animal companions) don’t willingly approach affected creatures unless the animal’s master succeeds at a DC 25 Handle Animal, Ride, or wild empathy check. Affected creatures take a –4 penalty on Handle Animal, Ride, and wild empathy checks against familiars, animal companions, animal cohorts, and other permanent companions provided by class abilities for the spell’s duration. Anyone an affected creature interacts with must succeed at a Will save or have its initial attitude automatically worsened by one step for the spell’s duration. Every time an affected creature attempts a Sense Motive check to get a hunch or detect a Bluff from another creature (or vice versa), it must succeed at a Will save or automatically assume the other party is lying or otherwise harbors ill will against it. Each time this spell causes an affected creature (or someone interacting with the affected creature) to attempt a Will saving throw, the spell’s hauntlike manifestation occurs."
      }
    ]
  },
  "warnings": []
}
