{
  "$schema": "../../../schemas/source-spell-observation.schema.json",
  "schema_version": "0.1.0",
  "observation_id": "d20pfsrd:spell.magic-circle-against-technology:a540d229e3307e2a",
  "entity_type": "spell",
  "source": {
    "site_id": "d20pfsrd",
    "url": "https://www.d20pfsrd.com/magic/all-spells/m/magic-circle-against-technology/",
    "license_url": "https://www.d20pfsrd.com/extras/legal/",
    "declared_publisher": "Paizo",
    "first_party_status": "confirmed"
  },
  "retrieval": {
    "retrieved_at": "2026-08-21T02:33:35.358Z",
    "http_status": 200,
    "content_sha256": "a540d229b364c1431057e4a07b3dbe7e66e1c918e71dc9018a2abd78e997a953",
    "raw_artifact_path": "../../raw/level-4/magic-circle-against-technology/d20pfsrd.html",
    "response_content_type": "text/html"
  },
  "parser": {
    "name": "d20pfsrd-bounded-spell-adapter",
    "version": "0.1.5",
    "parsed_at": "2026-08-21T02:33:35.364Z"
  },
  "page": {
    "title_raw": "Magic Circle Against Technology",
    "breadcrumbs_raw": [
      "Spells",
      "Magic Circle Against Technology"
    ],
    "license_notice_raw": null,
    "source_notice_raw": "Pathfinder Campaign Setting: Technology Guide © 2014, Paizo Inc.; Authors: James Jacobs and Russ Taylor."
  },
  "spell_raw": {
    "name_raw": "Magic Circle Against Technology",
    "alternate_names_raw": [],
    "school_raw": "abjuration",
    "subschool_raw": null,
    "descriptors_raw": [],
    "levels_raw": "cleric 4, sorcerer/wizard 4",
    "domains_raw": null,
    "casting_time_raw": "1 standard action",
    "components_raw": "V, S, M/DF (a 3-ft.-diameter circle of powdered copper)",
    "range_raw": "touch",
    "delivery_fields_raw": [],
    "duration_raw": "10 minute/level",
    "saving_throw_raw": "Will negates (harmless), see text",
    "spell_resistance_raw": "no; see text",
    "description_raw": "All creatures within the area gain the effects of a protection from technology spell. Creatures in the area, or that later enter the area, receive only one attempt to suppress technological effects that are controlling them. If a creature succeed at this save, such effects are suppressed as long as the creature remains in the area. Creatures that leave the area and then return are not protected. Robots receive a saving throw and spell resistance to avoid being kept at bay, but the deflection and resistance bonuses and the protection from mental control apply to non-technological creatures in the area even if a robot succeeds at its saving throw and is thus able to enter the area.\n\nThis spell is not cumulative with protection from technology and vice versa.",
    "links_raw": [
      {
        "anchor_text_raw": "abjuration",
        "href_raw": "https://www.d20pfsrd.com/magic#TOC-Abjuration",
        "href_resolved": "https://www.d20pfsrd.com/magic#TOC-Abjuration",
        "source_field": "spell_raw.school_raw",
        "context_raw": "spell_raw.school_raw",
        "role_hint": "classification",
        "target_entity_type_hint": "magic_school",
        "target_entity_id_hint": "magic-school.abjuration"
      },
      {
        "anchor_text_raw": "cleric",
        "href_raw": "https://www.d20pfsrd.com/magic/spell-lists-and-domains/spell-lists-cleric/",
        "href_resolved": "https://www.d20pfsrd.com/magic/spell-lists-and-domains/spell-lists-cleric/",
        "source_field": "spell_raw.levels_raw",
        "context_raw": "spell_raw.levels_raw",
        "role_hint": "spell_list",
        "target_entity_type_hint": "spell_list",
        "target_entity_id_hint": "spell-list.cleric"
      },
      {
        "anchor_text_raw": "sorcerer/wizard",
        "href_raw": "https://www.d20pfsrd.com/magic/spell-lists-and-domains/spell-lists-sorcerer-and-wizard/",
        "href_resolved": "https://www.d20pfsrd.com/magic/spell-lists-and-domains/spell-lists-sorcerer-and-wizard/",
        "source_field": "spell_raw.levels_raw",
        "context_raw": "spell_raw.levels_raw",
        "role_hint": "spell_list",
        "target_entity_type_hint": "spell_list",
        "target_entity_id_hint": "spell-list.sorcerer-wizard"
      },
      {
        "anchor_text_raw": "standard action",
        "href_raw": "https://www.d20pfsrd.com/gamemastering/combat#TOC-Standard-Actions",
        "href_resolved": "https://www.d20pfsrd.com/gamemastering/combat#TOC-Standard-Actions",
        "source_field": "spell_raw.casting_time_raw",
        "context_raw": "spell_raw.casting_time_raw",
        "role_hint": "definition",
        "target_entity_type_hint": "action",
        "target_entity_id_hint": "action.standard-action"
      },
      {
        "anchor_text_raw": "touch",
        "href_raw": "https://www.d20pfsrd.com/gamemastering/combat#TOC-Touch-Attacks",
        "href_resolved": "https://www.d20pfsrd.com/gamemastering/combat#TOC-Touch-Attacks",
        "source_field": "spell_raw.description_raw",
        "context_raw": "touch",
        "role_hint": "definition",
        "target_entity_type_hint": "rule",
        "target_entity_id_hint": "rule.touch"
      },
      {
        "anchor_text_raw": "Will",
        "href_raw": "https://www.d20pfsrd.com/gamemastering/combat#TOC-Will",
        "href_resolved": "https://www.d20pfsrd.com/gamemastering/combat#TOC-Will",
        "source_field": "spell_raw.description_raw",
        "context_raw": "Will",
        "role_hint": "definition",
        "target_entity_type_hint": "rule",
        "target_entity_id_hint": "rule.will"
      },
      {
        "anchor_text_raw": "spell resistance",
        "href_raw": "https://www.d20pfsrd.com/gamemastering/special-abilities#TOC-Spell-Resistance",
        "href_resolved": "https://www.d20pfsrd.com/gamemastering/special-abilities#TOC-Spell-Resistance",
        "source_field": "spell_raw.description_raw",
        "context_raw": "spell resistance",
        "role_hint": "definition",
        "target_entity_type_hint": "rule",
        "target_entity_id_hint": "rule.spell-resistance"
      },
      {
        "anchor_text_raw": "deflection",
        "href_raw": "https://www.d20pfsrd.com/basics-ability-scores/glossary#TOC-Bonus-Deflection-",
        "href_resolved": "https://www.d20pfsrd.com/basics-ability-scores/glossary#TOC-Bonus-Deflection-",
        "source_field": "spell_raw.description_raw",
        "context_raw": "deflection",
        "role_hint": "definition",
        "target_entity_type_hint": "rule",
        "target_entity_id_hint": "rule.deflection"
      },
      {
        "anchor_text_raw": "Pathfinder Campaign Setting: Technology Guide",
        "href_raw": "http://www.amazon.com/gp/product/1601256728/ref=as_li_qf_sp_asin_il_tl?ie=UTF8&camp=1789&creative=9325&creativeASIN=1601256728&linkCode=as2&tag=httpwwwd20pfs-20&linkId=I4WRDI766XR3RCYQ",
        "href_resolved": "http://www.amazon.com/gp/product/1601256728/ref=as_li_qf_sp_asin_il_tl?ie=UTF8&camp=1789&creative=9325&creativeASIN=1601256728&linkCode=as2&tag=httpwwwd20pfs-20&linkId=I4WRDI766XR3RCYQ",
        "source_field": "spell_raw.source_book_raw",
        "context_raw": "spell_raw.source_book_raw",
        "role_hint": "publication",
        "target_entity_type_hint": "publication",
        "target_entity_id_hint": "publication.pathfinder-campaign-setting-technology-guide"
      }
    ],
    "references_raw": [],
    "mythic_text_raw": null,
    "source_book_raw": "Pathfinder Campaign Setting: Technology Guide © 2014, Paizo Inc.; Authors: James Jacobs and Russ Taylor.",
    "source_page_raw": null,
    "supplemental_sources_raw": [],
    "pfs_status_raw": null,
    "sections_raw": [
      {
        "heading_raw": null,
        "body_raw": "All creatures within the area gain the effects of a protection from technology spell. Creatures in the area, or that later enter the area, receive only one attempt to suppress technological effects that are controlling them. If a creature succeed at this save, such effects are suppressed as long as the creature remains in the area. Creatures that leave the area and then return are not protected. Robots receive a saving throw and spell resistance to avoid being kept at bay, but the deflection and resistance bonuses and the protection from mental control apply to non-technological creatures in the area even if a robot succeeds at its saving throw and is thus able to enter the area.\n\nThis spell is not cumulative with protection from technology and vice versa."
      }
    ]
  },
  "warnings": []
}
