{
  "$schema": "../../../schemas/source-spell-observation.schema.json",
  "schema_version": "0.1.0",
  "observation_id": "legacy_aon:spell.wrath:e3958d3ec1ea8c6d",
  "entity_type": "spell",
  "source": {
    "site_id": "legacy_aon",
    "url": "https://legacy.aonprd.com/advancedPlayersGuide/spells/wrath.html",
    "license_url": "https://legacy.aonprd.com/openGameLicense.html",
    "declared_publisher": "Paizo",
    "first_party_status": "confirmed"
  },
  "retrieval": {
    "retrieved_at": "2026-08-19T23:27:36.492Z",
    "http_status": 200,
    "content_sha256": "e3958d3ee4be6bb936b6ba961f260dc23e5622fccef20a8f9816063f4c146692",
    "raw_artifact_path": "../../raw/level-1/wrath/legacy_aon.html",
    "response_content_type": "text/html"
  },
  "parser": {
    "name": "legacy_aon-bounded-spell-adapter",
    "version": "0.1.5",
    "parsed_at": "2026-08-19T23:27:36.495Z"
  },
  "page": {
    "title_raw": "Wrath",
    "breadcrumbs_raw": [
      "Spells",
      "Wrath"
    ],
    "license_notice_raw": null,
    "source_notice_raw": "Pathfinder Roleplaying Game: Advanced Player's Guide"
  },
  "spell_raw": {
    "name_raw": "Wrath",
    "alternate_names_raw": [],
    "school_raw": "enchantment (compulsion) [mind-affecting]",
    "subschool_raw": "compulsion",
    "descriptors_raw": [
      "mind-affecting"
    ],
    "levels_raw": "inquisitor 1",
    "domains_raw": null,
    "casting_time_raw": "1 standard action",
    "components_raw": "V, S, M (a thorny vine)",
    "range_raw": "personal",
    "delivery_fields_raw": [
      {
        "label_raw": "Target",
        "value_raw": "you",
        "kinds": [
          "target"
        ]
      }
    ],
    "duration_raw": "1 minute",
    "saving_throw_raw": null,
    "spell_resistance_raw": null,
    "description_raw": "You focus your anger against an enemy. Choose one enemy creature that you can see. You gain a +1 morale bonus on attack rolls and weapon damage rolls against that designated creature for every three caster levels you have (at least +1, maximum +3). You also receive this bonus on caster level checks made to overcome the creature's spell resistance, if any. At 12th level, you gain the benefits of the Improved Critical feat on attack rolls made against the designated creature. This effect doesn't stack with any other effect that expands the threat range of a weapon.",
    "links_raw": [
      {
        "anchor_text_raw": "Improved Critical",
        "href_raw": "../../coreRulebook/feats.html#improved-critical",
        "href_resolved": "https://legacy.aonprd.com/coreRulebook/feats.html#improved-critical",
        "source_field": "spell_raw.description_raw",
        "context_raw": "Improved Critical",
        "role_hint": "definition",
        "target_entity_type_hint": "rule",
        "target_entity_id_hint": "rule.improved-critical"
      }
    ],
    "references_raw": [],
    "mythic_text_raw": null,
    "source_book_raw": "Pathfinder Roleplaying Game: Advanced Player's Guide",
    "source_page_raw": null,
    "supplemental_sources_raw": [],
    "pfs_status_raw": null,
    "sections_raw": [
      {
        "heading_raw": null,
        "body_raw": "You focus your anger against an enemy. Choose one enemy creature that you can see. You gain a +1 morale bonus on attack rolls and weapon damage rolls against that designated creature for every three caster levels you have (at least +1, maximum +3). You also receive this bonus on caster level checks made to overcome the creature's spell resistance, if any. At 12th level, you gain the benefits of the Improved Critical feat on attack rolls made against the designated creature. This effect doesn't stack with any other effect that expands the threat range of a weapon."
      }
    ]
  },
  "warnings": []
}
