{
  "$schema": "../../../schemas/source-spell-observation.schema.json",
  "schema_version": "0.1.0",
  "observation_id": "d20pfsrd:spell.challenge-evil:9cb49840ed46ab8e",
  "entity_type": "spell",
  "source": {
    "site_id": "d20pfsrd",
    "url": "https://www.d20pfsrd.com/magic/all-spells/c/challenge-evil/",
    "license_url": "https://www.d20pfsrd.com/extras/legal/",
    "declared_publisher": "Paizo",
    "first_party_status": "confirmed"
  },
  "retrieval": {
    "retrieved_at": "2026-08-19T23:03:49.122Z",
    "http_status": 200,
    "content_sha256": "9cb49840c7fca44505b3f8497f311a1c6db6b8fc3d2cc8f76b28975d3373cc37",
    "raw_artifact_path": "../../raw/level-1/challenge-evil/d20pfsrd.html",
    "response_content_type": "text/html"
  },
  "parser": {
    "name": "d20pfsrd-bounded-spell-adapter",
    "version": "0.1.5",
    "parsed_at": "2026-08-19T23:03:49.127Z"
  },
  "page": {
    "title_raw": "Challenge Evil",
    "breadcrumbs_raw": [
      "Spells",
      "Challenge Evil"
    ],
    "license_notice_raw": null,
    "source_notice_raw": "Advanced Player’s Guide. Copyright 2010, Paizo Publishing, LLC; Author: Jason Bulmahn."
  },
  "spell_raw": {
    "name_raw": "Challenge Evil",
    "alternate_names_raw": [],
    "school_raw": "enchantment (compulsion) [mind-affecting]",
    "subschool_raw": "compulsion",
    "descriptors_raw": [
      "mind-affecting"
    ],
    "levels_raw": "paladin 1",
    "domains_raw": null,
    "casting_time_raw": "1 standard action",
    "components_raw": "V, DF",
    "range_raw": "close (25 ft. + 5 ft./2 levels)",
    "delivery_fields_raw": [
      {
        "label_raw": "Targets",
        "value_raw": "one evil creature",
        "kinds": [
          "target"
        ]
      }
    ],
    "duration_raw": "1 minute/level (D)",
    "saving_throw_raw": "Will negates",
    "spell_resistance_raw": "yes",
    "description_raw": "You challenge an evil creature to bring the fight to you, or suffer the consequences. You gain a +2 sacred bonus on all melee attacks against the subject of the spell. At the end of its turn, if the target has not made at least one attack on you, it becomes sickened. If you move away from the target, the spell ends.",
    "links_raw": [
      {
        "anchor_text_raw": "enchantment",
        "href_raw": "https://www.d20pfsrd.com/magic#TOC-Enchantment",
        "href_resolved": "https://www.d20pfsrd.com/magic#TOC-Enchantment",
        "source_field": "spell_raw.school_raw",
        "context_raw": "spell_raw.school_raw",
        "role_hint": "classification",
        "target_entity_type_hint": "magic_school",
        "target_entity_id_hint": "magic-school.enchantment"
      },
      {
        "anchor_text_raw": "mind-affecting",
        "href_raw": "https://www.d20pfsrd.com/magic#TOC-Magic-Descriptor-Mind-Affecting",
        "href_resolved": "https://www.d20pfsrd.com/magic#TOC-Magic-Descriptor-Mind-Affecting",
        "source_field": "spell_raw.school_raw",
        "context_raw": "spell_raw.school_raw",
        "role_hint": "classification",
        "target_entity_type_hint": "descriptor",
        "target_entity_id_hint": "descriptor.mind-affecting"
      },
      {
        "anchor_text_raw": "paladin",
        "href_raw": "https://www.d20pfsrd.com/magic/spell-lists-and-domains/spell-lists-paladin/",
        "href_resolved": "https://www.d20pfsrd.com/magic/spell-lists-and-domains/spell-lists-paladin/",
        "source_field": "spell_raw.levels_raw",
        "context_raw": "spell_raw.levels_raw",
        "role_hint": "spell_list",
        "target_entity_type_hint": "spell_list",
        "target_entity_id_hint": "spell-list.paladin"
      },
      {
        "anchor_text_raw": "standard action",
        "href_raw": "https://www.d20pfsrd.com/gamemastering/combat#TOC-Standard-Actions",
        "href_resolved": "https://www.d20pfsrd.com/gamemastering/combat#TOC-Standard-Actions",
        "source_field": "spell_raw.casting_time_raw",
        "context_raw": "spell_raw.casting_time_raw",
        "role_hint": "definition",
        "target_entity_type_hint": "action",
        "target_entity_id_hint": "action.standard-action"
      },
      {
        "anchor_text_raw": "evil",
        "href_raw": "https://www.d20pfsrd.com/bestiary/rules-for-monsters/creature-types#TOC-Evil",
        "href_resolved": "https://www.d20pfsrd.com/bestiary/rules-for-monsters/creature-types#TOC-Evil",
        "source_field": "spell_raw.description_raw",
        "context_raw": "evil",
        "role_hint": "definition",
        "target_entity_type_hint": "rule",
        "target_entity_id_hint": "rule.evil"
      },
      {
        "anchor_text_raw": "Will",
        "href_raw": "https://www.d20pfsrd.com/gamemastering/combat#TOC-Will",
        "href_resolved": "https://www.d20pfsrd.com/gamemastering/combat#TOC-Will",
        "source_field": "spell_raw.description_raw",
        "context_raw": "Will",
        "role_hint": "definition",
        "target_entity_type_hint": "rule",
        "target_entity_id_hint": "rule.will"
      },
      {
        "anchor_text_raw": "evil",
        "href_raw": "https://www.d20pfsrd.com/bestiary/rules-for-monsters/creature-types#TOC-Evil",
        "href_resolved": "https://www.d20pfsrd.com/bestiary/rules-for-monsters/creature-types#TOC-Evil",
        "source_field": "spell_raw.description_raw",
        "context_raw": "evil",
        "role_hint": "definition",
        "target_entity_type_hint": "rule",
        "target_entity_id_hint": "rule.evil"
      },
      {
        "anchor_text_raw": "sacred bonus",
        "href_raw": "https://www.d20pfsrd.com/basics-ability-scores/glossary#TOC-Sacred-Bonus",
        "href_resolved": "https://www.d20pfsrd.com/basics-ability-scores/glossary#TOC-Sacred-Bonus",
        "source_field": "spell_raw.description_raw",
        "context_raw": "sacred bonus",
        "role_hint": "definition",
        "target_entity_type_hint": "rule",
        "target_entity_id_hint": "rule.sacred-bonus"
      },
      {
        "anchor_text_raw": "sickened",
        "href_raw": "https://www.d20pfsrd.com/gamemastering/conditions#TOC-Sickened",
        "href_resolved": "https://www.d20pfsrd.com/gamemastering/conditions#TOC-Sickened",
        "source_field": "spell_raw.description_raw",
        "context_raw": "sickened",
        "role_hint": "definition",
        "target_entity_type_hint": "condition",
        "target_entity_id_hint": "condition.sickened"
      },
      {
        "anchor_text_raw": "Advanced Player’s Guide",
        "href_raw": "https://www.opengamingstore.com/products/pathfinder-roleplaying-game-advanced-players-guide",
        "href_resolved": "https://www.opengamingstore.com/products/pathfinder-roleplaying-game-advanced-players-guide",
        "source_field": "spell_raw.source_book_raw",
        "context_raw": "spell_raw.source_book_raw",
        "role_hint": "publication",
        "target_entity_type_hint": "publication",
        "target_entity_id_hint": "publication.advanced-players-guide"
      }
    ],
    "references_raw": [],
    "mythic_text_raw": null,
    "source_book_raw": "Advanced Player’s Guide. Copyright 2010, Paizo Publishing, LLC; Author: Jason Bulmahn.",
    "source_page_raw": null,
    "supplemental_sources_raw": [],
    "pfs_status_raw": null,
    "sections_raw": [
      {
        "heading_raw": null,
        "body_raw": "You challenge an evil creature to bring the fight to you, or suffer the consequences. You gain a +2 sacred bonus on all melee attacks against the subject of the spell. At the end of its turn, if the target has not made at least one attack on you, it becomes sickened. If you move away from the target, the spell ends."
      }
    ]
  },
  "warnings": []
}
