{
  "$schema": "../../../schemas/source-spell-observation.schema.json",
  "schema_version": "0.1.0",
  "observation_id": "aon:spell.diminish-plants:12495e7f92c6ff52",
  "entity_type": "spell",
  "source": {
    "site_id": "aon",
    "url": "https://www.aonprd.com/SpellDisplay.aspx?ItemName=Diminish+Plants",
    "license_url": "https://www.aonprd.com/Licenses.aspx",
    "declared_publisher": "Paizo",
    "first_party_status": "confirmed"
  },
  "retrieval": {
    "retrieved_at": "2026-08-20T08:13:30.463Z",
    "http_status": 200,
    "content_sha256": "12495e7f53b745415e149084a32dec6cff846b3ebbbfd6efd9abddc68a048a19",
    "raw_artifact_path": "../../raw/level-3/diminish-plants/aon.html",
    "response_content_type": "text/html; charset=utf-8"
  },
  "parser": {
    "name": "aon-bounded-spell-adapter",
    "version": "0.1.5",
    "parsed_at": "2026-08-20T08:13:30.465Z"
  },
  "page": {
    "title_raw": "Diminish Plants",
    "breadcrumbs_raw": [
      "Spells",
      "Diminish Plants"
    ],
    "license_notice_raw": null,
    "source_notice_raw": "PRPG Core Rulebook pg. 270"
  },
  "spell_raw": {
    "name_raw": "Diminish Plants",
    "alternate_names_raw": [],
    "school_raw": "transmutation",
    "subschool_raw": null,
    "descriptors_raw": [],
    "levels_raw": "druid 3, hunter 3, ranger 3",
    "domains_raw": null,
    "casting_time_raw": "1 standard action",
    "components_raw": "V, S, DF",
    "range_raw": "see text",
    "delivery_fields_raw": [],
    "duration_raw": "instantaneous",
    "saving_throw_raw": "none",
    "spell_resistance_raw": "no",
    "description_raw": "This spell has two versions.\n\nPrune Growth: This version of the spell causes normal vegetation within long range (400 feet + 40 feet per level) to shrink to about one-third normal size, becoming untangled and less bushy. The affected vegetation appears to have been carefully pruned and trimmed. This version of diminish plants automatically dispels any spells or effects that enhance plants, such as entangle, plant growth, and wall of thorns.\n\nAt your option, the area can be a 100-foot-radius circle, a 150-foot-radius semicircle, or a 200-foot-radius quarter-circle. You may also designate portions of the area that are not affected.\n\nStunt Growth: This version of the spell targets all normal plants within a range of 1/2 mile, reducing their potential productivity over the course of the following year to half normal.\n\nThis spell has no effect on plant creatures.",
    "links_raw": [
      {
        "anchor_text_raw": "PRPG Core Rulebook pg. 270",
        "href_raw": "http://paizo.com/pathfinderRPG/v5748btpy88yj",
        "href_resolved": "http://paizo.com/pathfinderRPG/v5748btpy88yj",
        "source_field": "spell_raw.source_book_raw",
        "context_raw": "spell_raw.source_book_raw",
        "role_hint": "publication",
        "target_entity_type_hint": "publication",
        "target_entity_id_hint": "publication.pathfinder-rpg-core-rulebook"
      },
      {
        "anchor_text_raw": "transmutation",
        "href_raw": "SpellDefinitions.aspx?ID=8",
        "href_resolved": "https://www.aonprd.com/SpellDefinitions.aspx?ID=8",
        "source_field": "spell_raw.school_raw",
        "context_raw": "spell_raw.school_raw",
        "role_hint": "classification",
        "target_entity_type_hint": "magic_school",
        "target_entity_id_hint": "magic-school.transmutation"
      }
    ],
    "references_raw": [],
    "mythic_text_raw": null,
    "source_book_raw": "PRPG Core Rulebook",
    "source_page_raw": "270",
    "supplemental_sources_raw": [],
    "pfs_status_raw": "legal",
    "sections_raw": [
      {
        "heading_raw": null,
        "body_raw": "This spell has two versions.\n\nPrune Growth: This version of the spell causes normal vegetation within long range (400 feet + 40 feet per level) to shrink to about one-third normal size, becoming untangled and less bushy. The affected vegetation appears to have been carefully pruned and trimmed. This version of diminish plants automatically dispels any spells or effects that enhance plants, such as entangle, plant growth, and wall of thorns.\n\nAt your option, the area can be a 100-foot-radius circle, a 150-foot-radius semicircle, or a 200-foot-radius quarter-circle. You may also designate portions of the area that are not affected.\n\nStunt Growth: This version of the spell targets all normal plants within a range of 1/2 mile, reducing their potential productivity over the course of the following year to half normal.\n\nThis spell has no effect on plant creatures."
      }
    ]
  },
  "warnings": []
}
