{
  "$schema": "../../../schemas/source-spell-observation.schema.json",
  "schema_version": "0.1.0",
  "observation_id": "legacy_aon:spell.mask-dweomer-communal:7715975caab4c076",
  "entity_type": "spell",
  "source": {
    "site_id": "legacy_aon",
    "url": "https://legacy.aonprd.com/ultimateCombat/spells/maskDweomer.html",
    "license_url": "https://legacy.aonprd.com/openGameLicense.html",
    "declared_publisher": "Paizo",
    "first_party_status": "confirmed"
  },
  "retrieval": {
    "retrieved_at": "2026-08-19T23:53:41.720Z",
    "http_status": 200,
    "content_sha256": "7715975c0e9cc8f9926ef26c723443082274f77adde7d13a81253e1d8b486898",
    "raw_artifact_path": "../../raw/level-2/mask-dweomer-communal/legacy_aon.html",
    "response_content_type": "text/html"
  },
  "parser": {
    "name": "legacy_aon-bounded-spell-adapter",
    "version": "0.1.5",
    "parsed_at": "2026-08-19T23:53:41.722Z"
  },
  "page": {
    "title_raw": "Mask Dweomer, Communal",
    "breadcrumbs_raw": [
      "Spells",
      "Mask Dweomer, Communal"
    ],
    "license_notice_raw": null,
    "source_notice_raw": "Pathfinder Roleplaying Game: Ultimate Combat"
  },
  "spell_raw": {
    "name_raw": "Mask Dweomer, Communal",
    "alternate_names_raw": [],
    "school_raw": null,
    "subschool_raw": null,
    "descriptors_raw": [],
    "levels_raw": "witch 2",
    "domains_raw": null,
    "casting_time_raw": null,
    "components_raw": null,
    "range_raw": null,
    "delivery_fields_raw": [
      {
        "label_raw": "Target",
        "value_raw": "creatures or objects touched",
        "kinds": [
          "target"
        ]
      }
    ],
    "duration_raw": null,
    "saving_throw_raw": null,
    "spell_resistance_raw": null,
    "description_raw": "This spell functions like mask dweomer , except you divide the duration in 1-day increments among the creatures or objects touched.",
    "links_raw": [
      {
        "anchor_text_raw": "mask dweomer",
        "href_raw": "../../advancedPlayersGuide/spells/maskDweomer.html#mask-dweomer",
        "href_resolved": "https://legacy.aonprd.com/advancedPlayersGuide/spells/maskDweomer.html#mask-dweomer",
        "source_field": "spell_raw.description_raw",
        "context_raw": "mask dweomer",
        "role_hint": "cross_reference",
        "target_entity_type_hint": "spell",
        "target_entity_id_hint": "spell.mask-dweomer"
      }
    ],
    "references_raw": [
      {
        "anchor_text_raw": "mask dweomer",
        "href_raw": "../../advancedPlayersGuide/spells/maskDweomer.html#mask-dweomer",
        "evidence_kind": "hyperlink",
        "source_field": "spell_raw.description_raw",
        "context_raw": "mask dweomer",
        "target_entity_type": "spell",
        "target_name_hint": "mask dweomer",
        "relationship_hint": "functions_like"
      }
    ],
    "mythic_text_raw": null,
    "source_book_raw": "Pathfinder Roleplaying Game: Ultimate Combat",
    "source_page_raw": null,
    "supplemental_sources_raw": [],
    "pfs_status_raw": null,
    "sections_raw": [
      {
        "heading_raw": null,
        "body_raw": "This spell functions like mask dweomer , except you divide the duration in 1-day increments among the creatures or objects touched."
      }
    ]
  },
  "warnings": [
    {
      "code": "MISSING_EXPECTED_FIELD",
      "severity": "error",
      "field": "school_raw",
      "message": "Parser did not find school_raw."
    },
    {
      "code": "MISSING_EXPECTED_FIELD",
      "severity": "error",
      "field": "casting_time_raw",
      "message": "Parser did not find casting_time_raw."
    },
    {
      "code": "MISSING_EXPECTED_FIELD",
      "severity": "error",
      "field": "components_raw",
      "message": "Parser did not find components_raw."
    },
    {
      "code": "MISSING_EXPECTED_FIELD",
      "severity": "error",
      "field": "range_raw",
      "message": "Parser did not find range_raw."
    },
    {
      "code": "MISSING_EXPECTED_FIELD",
      "severity": "error",
      "field": "duration_raw",
      "message": "Parser did not find duration_raw."
    }
  ]
}
