{
  "$schema": "../../../schemas/source-spell-observation.schema.json",
  "schema_version": "0.1.0",
  "observation_id": "legacy_aon:spell.companion-mind-link:8a140471effb4626",
  "entity_type": "spell",
  "source": {
    "site_id": "legacy_aon",
    "url": "https://legacy.aonprd.com/ultimateCombat/spells/companionMindLink.html",
    "license_url": "https://legacy.aonprd.com/openGameLicense.html",
    "declared_publisher": "Paizo",
    "first_party_status": "confirmed"
  },
  "retrieval": {
    "retrieved_at": "2026-08-20T08:10:44.830Z",
    "http_status": 200,
    "content_sha256": "8a140471aec33c8b6eb5a2a88679a6cd45b0678381de3f351d39d132ec5ee06d",
    "raw_artifact_path": "../../raw/level-3/companion-mind-link/legacy_aon.html",
    "response_content_type": "text/html"
  },
  "parser": {
    "name": "legacy_aon-bounded-spell-adapter",
    "version": "0.1.5",
    "parsed_at": "2026-08-20T08:10:44.832Z"
  },
  "page": {
    "title_raw": "Companion Mind Link",
    "breadcrumbs_raw": [
      "Spells",
      "Companion Mind Link"
    ],
    "license_notice_raw": null,
    "source_notice_raw": "Pathfinder Roleplaying Game: Ultimate Combat"
  },
  "spell_raw": {
    "name_raw": "Companion Mind Link",
    "alternate_names_raw": [],
    "school_raw": "enchantment (charm) [mind-affecting]",
    "subschool_raw": "charm",
    "descriptors_raw": [
      "mind-affecting"
    ],
    "levels_raw": "druid 3, ranger 3",
    "domains_raw": null,
    "casting_time_raw": "1 standard action",
    "components_raw": "V, S",
    "range_raw": "close (25 ft. + 5 ft./2 levels)",
    "delivery_fields_raw": [
      {
        "label_raw": "Target",
        "value_raw": "your animal companion",
        "kinds": [
          "target"
        ]
      }
    ],
    "duration_raw": "1 minute/level",
    "saving_throw_raw": null,
    "spell_resistance_raw": null,
    "description_raw": "The link between you and your animal companion becomes stronger. As long as you are within line of sight of your animal companion, you can telepathically communicate with it as if you two shared a language. Also, as long as you are within line of sight of the animal companion, you can push your animal companion a swift action instead of a move action, and you do not need to succeed at Handle Animal checks to handle your animal companion. Such checks automatically succeed.",
    "links_raw": [
      {
        "anchor_text_raw": "animal",
        "href_raw": "../../bestiary/creatureTypes.html#animal",
        "href_resolved": "https://legacy.aonprd.com/bestiary/creatureTypes.html#animal",
        "source_field": "spell_raw.description_raw",
        "context_raw": "animal",
        "role_hint": "definition",
        "target_entity_type_hint": "rule",
        "target_entity_id_hint": "rule.animal"
      },
      {
        "anchor_text_raw": "Handle Animal",
        "href_raw": "../../coreRulebook/skills/handleAnimal.html#handle-animal",
        "href_resolved": "https://legacy.aonprd.com/coreRulebook/skills/handleAnimal.html#handle-animal",
        "source_field": "spell_raw.description_raw",
        "context_raw": "Handle Animal",
        "role_hint": "definition",
        "target_entity_type_hint": "rule",
        "target_entity_id_hint": "rule.handle-animal"
      }
    ],
    "references_raw": [],
    "mythic_text_raw": null,
    "source_book_raw": "Pathfinder Roleplaying Game: Ultimate Combat",
    "source_page_raw": null,
    "supplemental_sources_raw": [],
    "pfs_status_raw": null,
    "sections_raw": [
      {
        "heading_raw": null,
        "body_raw": "The link between you and your animal companion becomes stronger. As long as you are within line of sight of your animal companion, you can telepathically communicate with it as if you two shared a language. Also, as long as you are within line of sight of the animal companion, you can push your animal companion a swift action instead of a move action, and you do not need to succeed at Handle Animal checks to handle your animal companion. Such checks automatically succeed."
      }
    ]
  },
  "warnings": []
}
