{
  "$schema": "../../../schemas/source-spell-observation.schema.json",
  "schema_version": "0.1.0",
  "observation_id": "d20pfsrd:spell.fickle-winds:03a0715b5ae87a56",
  "entity_type": "spell",
  "source": {
    "site_id": "d20pfsrd",
    "url": "https://www.d20pfsrd.com/magic/all-spells/f/fickle-winds/",
    "license_url": "https://www.d20pfsrd.com/extras/legal/",
    "declared_publisher": "Paizo",
    "first_party_status": "confirmed"
  },
  "retrieval": {
    "retrieved_at": "2026-08-20T08:15:56.972Z",
    "http_status": 200,
    "content_sha256": "03a0715bf0b991698d022c66a27fa32967d15338c4005744a1d06d8b2aa93a8d",
    "raw_artifact_path": "../../raw/level-3/fickle-winds/d20pfsrd.html",
    "response_content_type": "text/html"
  },
  "parser": {
    "name": "d20pfsrd-bounded-spell-adapter",
    "version": "0.1.5",
    "parsed_at": "2026-08-20T08:15:56.976Z"
  },
  "page": {
    "title_raw": "Fickle Winds",
    "breadcrumbs_raw": [
      "Spells",
      "Fickle Winds"
    ],
    "license_notice_raw": null,
    "source_notice_raw": "Pathfinder Roleplaying Game: Ultimate Magic"
  },
  "spell_raw": {
    "name_raw": "Fickle Winds",
    "alternate_names_raw": [],
    "school_raw": "transmutation [air]",
    "subschool_raw": null,
    "descriptors_raw": [
      "air"
    ],
    "levels_raw": "cleric/oracle 5, druid 5, ranger 3, sorcerer/wizard 5",
    "domains_raw": null,
    "casting_time_raw": "1 standard action",
    "components_raw": "Unofficial: V, S1",
    "range_raw": null,
    "delivery_fields_raw": [
      {
        "label_raw": "Targets",
        "value_raw": "one or more Medium creatures/level, no two of which can be more than 30 ft. apart",
        "kinds": [
          "target"
        ]
      }
    ],
    "duration_raw": "1 minute/level (D)",
    "saving_throw_raw": "none (see text)",
    "spell_resistance_raw": "yes",
    "description_raw": "You create a mobile cylinder of wind encompassing every target of the spell and protecting them as wind wall, but not interfering with them in any way. For example, arrows and bolts fired at the targets are deflected upward and miss, but the targets’ own arrows or bolts pass through the wall as if it were not there.\n\nA Large creature counts as 4 Medium creatures for the purpose of how many targets you can effect with the spell; a Huge creature counts as 8, a Gargantuan creature as 16, and a Colossal creature as 32. This spell has no effect within the area of a higher-level wind or weather spell.",
    "links_raw": [
      {
        "anchor_text_raw": "transmutation",
        "href_raw": "https://www.d20pfsrd.com/magic#TOC-Transmutation",
        "href_resolved": "https://www.d20pfsrd.com/magic#TOC-Transmutation",
        "source_field": "spell_raw.school_raw",
        "context_raw": "spell_raw.school_raw",
        "role_hint": "classification",
        "target_entity_type_hint": "magic_school",
        "target_entity_id_hint": "magic-school.transmutation"
      },
      {
        "anchor_text_raw": "cleric/oracle",
        "href_raw": "https://www.d20pfsrd.com/magic/spell-lists-and-domains/spell-lists-cleric/",
        "href_resolved": "https://www.d20pfsrd.com/magic/spell-lists-and-domains/spell-lists-cleric/",
        "source_field": "spell_raw.levels_raw",
        "context_raw": "spell_raw.levels_raw",
        "role_hint": "spell_list",
        "target_entity_type_hint": "spell_list",
        "target_entity_id_hint": "spell-list.cleric-oracle"
      },
      {
        "anchor_text_raw": "druid",
        "href_raw": "https://www.d20pfsrd.com/classes/core-classes/druid",
        "href_resolved": "https://www.d20pfsrd.com/classes/core-classes/druid",
        "source_field": "spell_raw.levels_raw",
        "context_raw": "spell_raw.levels_raw",
        "role_hint": "spell_list",
        "target_entity_type_hint": "spell_list",
        "target_entity_id_hint": "spell-list.druid"
      },
      {
        "anchor_text_raw": "ranger",
        "href_raw": "https://www.d20pfsrd.com/classes/core-classes/ranger",
        "href_resolved": "https://www.d20pfsrd.com/classes/core-classes/ranger",
        "source_field": "spell_raw.levels_raw",
        "context_raw": "spell_raw.levels_raw",
        "role_hint": "spell_list",
        "target_entity_type_hint": "spell_list",
        "target_entity_id_hint": "spell-list.ranger"
      },
      {
        "anchor_text_raw": "sorcerer/wizard",
        "href_raw": "https://www.d20pfsrd.com/magic/spell-lists-and-domains/spell-lists-sorcerer-and-wizard/",
        "href_resolved": "https://www.d20pfsrd.com/magic/spell-lists-and-domains/spell-lists-sorcerer-and-wizard/",
        "source_field": "spell_raw.levels_raw",
        "context_raw": "spell_raw.levels_raw",
        "role_hint": "spell_list",
        "target_entity_type_hint": "spell_list",
        "target_entity_id_hint": "spell-list.sorcerer-wizard"
      },
      {
        "anchor_text_raw": "wood",
        "href_raw": "https://www.d20pfsrd.com/classes/core-classes/wizard/arcane-schools/paizo-arcane-schools/elemental-arcane-schools/wood",
        "href_resolved": "https://www.d20pfsrd.com/classes/core-classes/wizard/arcane-schools/paizo-arcane-schools/elemental-arcane-schools/wood",
        "source_field": "spell_raw.description_raw",
        "context_raw": "wood",
        "role_hint": "definition",
        "target_entity_type_hint": "rule",
        "target_entity_id_hint": "rule.wood"
      },
      {
        "anchor_text_raw": "standard action",
        "href_raw": "https://www.d20pfsrd.com/gamemastering/combat#TOC-Standard-Actions",
        "href_resolved": "https://www.d20pfsrd.com/gamemastering/combat#TOC-Standard-Actions",
        "source_field": "spell_raw.casting_time_raw",
        "context_raw": "spell_raw.casting_time_raw",
        "role_hint": "definition",
        "target_entity_type_hint": "action",
        "target_entity_id_hint": "action.standard-action"
      },
      {
        "anchor_text_raw": "here",
        "href_raw": "http://paizo.com/paizo/messageboards/paizoPublishing/pathfinder/pathfinderRPG/paizo/ultimateMagicErrata&page=6#296",
        "href_resolved": "http://paizo.com/paizo/messageboards/paizoPublishing/pathfinder/pathfinderRPG/paizo/ultimateMagicErrata&page=6#296",
        "source_field": "spell_raw.source_book_raw",
        "context_raw": "spell_raw.source_book_raw",
        "role_hint": "publication",
        "target_entity_type_hint": "publication",
        "target_entity_id_hint": "publication.here"
      },
      {
        "anchor_text_raw": "wind wall",
        "href_raw": "https://www.d20pfsrd.com/magic/all-spells/f/w/wind-wall",
        "href_resolved": "https://www.d20pfsrd.com/magic/all-spells/f/w/wind-wall",
        "source_field": "spell_raw.description_raw",
        "context_raw": "wind wall",
        "role_hint": "cross_reference",
        "target_entity_type_hint": "spell",
        "target_entity_id_hint": "spell.wind-wall"
      },
      {
        "anchor_text_raw": "Pathfinder Roleplaying Game: Ultimate Magic",
        "href_raw": "http://www.amazon.com/gp/product/1601252994/ref=as_li_qf_sp_asin_il_tl?ie=UTF8&camp=1789&creative=9325&creativeASIN=1601252994&linkCode=as2&tag=httpwwwd20pfs-20",
        "href_resolved": "http://www.amazon.com/gp/product/1601252994/ref=as_li_qf_sp_asin_il_tl?ie=UTF8&camp=1789&creative=9325&creativeASIN=1601252994&linkCode=as2&tag=httpwwwd20pfs-20",
        "source_field": "spell_raw.source_book_raw",
        "context_raw": "spell_raw.source_book_raw",
        "role_hint": "publication",
        "target_entity_type_hint": "publication",
        "target_entity_id_hint": "publication.pathfinder-rpg-ultimate-magic"
      }
    ],
    "references_raw": [
      {
        "anchor_text_raw": "wind wall",
        "href_raw": "https://www.d20pfsrd.com/magic/all-spells/f/w/wind-wall",
        "evidence_kind": "hyperlink",
        "source_field": "spell_raw.description_raw",
        "context_raw": "wind wall",
        "target_entity_type": "spell",
        "target_name_hint": "wind wall",
        "relationship_hint": "functions_like"
      }
    ],
    "mythic_text_raw": null,
    "source_book_raw": "Pathfinder Roleplaying Game: Ultimate Magic",
    "source_page_raw": null,
    "supplemental_sources_raw": [],
    "pfs_status_raw": null,
    "sections_raw": [
      {
        "heading_raw": null,
        "body_raw": "You create a mobile cylinder of wind encompassing every target of the spell and protecting them as wind wall, but not interfering with them in any way. For example, arrows and bolts fired at the targets are deflected upward and miss, but the targets’ own arrows or bolts pass through the wall as if it were not there.\n\nA Large creature counts as 4 Medium creatures for the purpose of how many targets you can effect with the spell; a Huge creature counts as 8, a Gargantuan creature as 16, and a Colossal creature as 32. This spell has no effect within the area of a higher-level wind or weather spell."
      }
    ]
  },
  "warnings": [
    {
      "code": "MISSING_EXPECTED_FIELD",
      "severity": "error",
      "field": "range_raw",
      "message": "Parser did not find range_raw."
    }
  ]
}
