{
  "$schema": "../../../schemas/source-spell-observation.schema.json",
  "schema_version": "0.1.0",
  "observation_id": "aon:spell.weapons-against-evil:95f5eb2c5351258c",
  "entity_type": "spell",
  "source": {
    "site_id": "aon",
    "url": "https://www.aonprd.com/SpellDisplay.aspx?ItemName=Weapons+Against+Evil",
    "license_url": "https://www.aonprd.com/Licenses.aspx",
    "declared_publisher": "Paizo",
    "first_party_status": "confirmed"
  },
  "retrieval": {
    "retrieved_at": "2026-08-19T23:27:10.556Z",
    "http_status": 200,
    "content_sha256": "95f5eb2c7634095ec26d3fe923aa6d310e56a4772dcb93d170bf9b010503edc6",
    "raw_artifact_path": "../../raw/level-1/weapons-against-evil/aon.html",
    "response_content_type": "text/html; charset=utf-8"
  },
  "parser": {
    "name": "aon-bounded-spell-adapter",
    "version": "0.1.6",
    "parsed_at": "2026-08-21T16:48:49.943Z"
  },
  "page": {
    "title_raw": "Weapons Against Evil",
    "breadcrumbs_raw": [
      "Spells",
      "Weapons Against Evil"
    ],
    "license_notice_raw": null,
    "source_notice_raw": "Inner Sea Gods pg. 245, Faiths of Purity pg. 29"
  },
  "spell_raw": {
    "name_raw": "Weapons Against Evil",
    "alternate_names_raw": [],
    "school_raw": "transmutation",
    "subschool_raw": null,
    "descriptors_raw": [],
    "levels_raw": "cleric 1, inquisitor 1, oracle 1, paladin 1, warpriest 1 (Iomedae)",
    "domains_raw": null,
    "casting_time_raw": "1 standard action",
    "components_raw": "V, DF",
    "range_raw": "close (25 ft. + 5 ft./2 levels)",
    "delivery_fields_raw": [
      {
        "label_raw": "Targets",
        "value_raw": "one weapon/level, no two of which can be more than 20 ft. apart",
        "kinds": [
          "target"
        ]
      }
    ],
    "duration_raw": "1 round/level",
    "saving_throw_raw": "Fortitude negates (harmless, object)",
    "spell_resistance_raw": "yes (harmless, object)",
    "description_raw": "Each weapon this spell affects each shines with pale light that dimly illuminates a 5-foot square. These weapons also ignore the DR of evil creatures that have DR 5 or lower, as long as the damage reduction is not DR/epic.",
    "links_raw": [
      {
        "anchor_text_raw": "Inner Sea Gods pg. 245",
        "href_raw": "http://paizo.com/products/btpy94wj?Pathfinder-Campaign-Setting-Inner-Sea-Gods-Hardcover",
        "href_resolved": "http://paizo.com/products/btpy94wj?Pathfinder-Campaign-Setting-Inner-Sea-Gods-Hardcover",
        "source_field": "spell_raw.source_book_raw",
        "context_raw": "spell_raw.source_book_raw",
        "role_hint": "publication",
        "target_entity_type_hint": "publication",
        "target_entity_id_hint": "publication.inner-sea-gods"
      },
      {
        "anchor_text_raw": "Faiths of Purity pg. 29",
        "href_raw": "http://paizo.com/store/games/roleplayingGames/p/pathfinderRPG/paizo/pathfinderCompanion/v5748btpy8j60",
        "href_resolved": "http://paizo.com/store/games/roleplayingGames/p/pathfinderRPG/paizo/pathfinderCompanion/v5748btpy8j60",
        "source_field": "spell_raw.source_book_raw",
        "context_raw": "spell_raw.source_book_raw",
        "role_hint": "publication",
        "target_entity_type_hint": "publication",
        "target_entity_id_hint": "publication.faiths-of-purity"
      },
      {
        "anchor_text_raw": "transmutation",
        "href_raw": "SpellDefinitions.aspx?ID=8",
        "href_resolved": "https://www.aonprd.com/SpellDefinitions.aspx?ID=8",
        "source_field": "spell_raw.school_raw",
        "context_raw": "spell_raw.school_raw",
        "role_hint": "classification",
        "target_entity_type_hint": "magic_school",
        "target_entity_id_hint": "magic-school.transmutation"
      }
    ],
    "references_raw": [],
    "mythic_text_raw": null,
    "source_book_raw": "Inner Sea Gods pg. 245, Faiths of Purity",
    "source_page_raw": "29",
    "supplemental_sources_raw": [],
    "pfs_status_raw": "legal",
    "sections_raw": [
      {
        "heading_raw": null,
        "body_raw": "Each weapon this spell affects each shines with pale light that dimly illuminates a 5-foot square. These weapons also ignore the DR of evil creatures that have DR 5 or lower, as long as the damage reduction is not DR/epic."
      }
    ]
  },
  "warnings": []
}
