{
  "$schema": "../../../schemas/source-spell-observation.schema.json",
  "schema_version": "0.1.0",
  "observation_id": "aon:spell.planar-ally-greater:de06a61b70347782",
  "entity_type": "spell",
  "source": {
    "site_id": "aon",
    "url": "https://www.aonprd.com/SpellDisplay.aspx?ItemName=Planar+Ally%2C+Greater",
    "license_url": "https://www.aonprd.com/Licenses.aspx",
    "declared_publisher": "Paizo",
    "first_party_status": "confirmed"
  },
  "retrieval": {
    "retrieved_at": "2026-08-21T03:53:25.388Z",
    "http_status": 200,
    "content_sha256": "de06a61b20e3bf15c38f19c13366e62d77dc00ac8aab81abcb6ae1d947463364",
    "raw_artifact_path": "../../raw/level-8/planar-ally-greater/aon.html",
    "response_content_type": "text/html; charset=utf-8"
  },
  "parser": {
    "name": "aon-bounded-spell-adapter",
    "version": "0.1.6",
    "parsed_at": "2026-08-21T05:52:53.692Z"
  },
  "page": {
    "title_raw": "Planar Ally, Greater",
    "breadcrumbs_raw": [
      "Spells",
      "Planar Ally, Greater"
    ],
    "license_notice_raw": null,
    "source_notice_raw": "PRPG Core Rulebook pg. 320"
  },
  "spell_raw": {
    "name_raw": "Planar Ally, Greater",
    "alternate_names_raw": [],
    "school_raw": "conjuration (calling) [see text for lesser planar ally]",
    "subschool_raw": "calling",
    "descriptors_raw": [
      "see text for lesser planar ally"
    ],
    "levels_raw": "cleric 8, oracle 8, psychic 8, shaman 8",
    "domains_raw": null,
    "casting_time_raw": "10 minutes",
    "components_raw": "V, S, M (offerings worth 2,500 plus payment), DF",
    "range_raw": "close (25 ft. + 5 ft./2 levels)",
    "delivery_fields_raw": [
      {
        "label_raw": "Effect",
        "value_raw": "up to three called outsiders, totaling no more than 18 HD, no two of which can be more than 30 ft. apart when they appear",
        "kinds": [
          "effect"
        ]
      }
    ],
    "duration_raw": "instantaneous",
    "saving_throw_raw": "none",
    "spell_resistance_raw": "no",
    "description_raw": "This spell functions like lesser planar ally, except that you may call a single creature of 18 HD or less, or up to three creatures of the same kind whose Hit Dice total no more than 18. The creatures agree to help you and request your return payment together.",
    "links_raw": [
      {
        "anchor_text_raw": "PRPG Core Rulebook pg. 320",
        "href_raw": "http://paizo.com/pathfinderRPG/v5748btpy88yj",
        "href_resolved": "http://paizo.com/pathfinderRPG/v5748btpy88yj",
        "source_field": "spell_raw.source_book_raw",
        "context_raw": "spell_raw.source_book_raw",
        "role_hint": "publication",
        "target_entity_type_hint": "publication",
        "target_entity_id_hint": "publication.pathfinder-rpg-core-rulebook"
      },
      {
        "anchor_text_raw": "conjuration",
        "href_raw": "SpellDefinitions.aspx?ID=2",
        "href_resolved": "https://www.aonprd.com/SpellDefinitions.aspx?ID=2",
        "source_field": "spell_raw.school_raw",
        "context_raw": "spell_raw.school_raw",
        "role_hint": "classification",
        "target_entity_type_hint": "magic_school",
        "target_entity_id_hint": "magic-school.conjuration"
      },
      {
        "anchor_text_raw": "calling",
        "href_raw": "SpellDefinitions.aspx?ID=10",
        "href_resolved": "https://www.aonprd.com/SpellDefinitions.aspx?ID=10",
        "source_field": "spell_raw.school_raw",
        "context_raw": "spell_raw.school_raw",
        "role_hint": "classification",
        "target_entity_type_hint": "subschool",
        "target_entity_id_hint": "subschool.calling"
      }
    ],
    "references_raw": [],
    "mythic_text_raw": null,
    "source_book_raw": "PRPG Core Rulebook",
    "source_page_raw": "320",
    "supplemental_sources_raw": [],
    "pfs_status_raw": "legal",
    "sections_raw": [
      {
        "heading_raw": null,
        "body_raw": "This spell functions like lesser planar ally, except that you may call a single creature of 18 HD or less, or up to three creatures of the same kind whose Hit Dice total no more than 18. The creatures agree to help you and request your return payment together."
      }
    ]
  },
  "warnings": []
}
